index,id,comment_text,toxic,severe_toxic,obscene,threat,insult,identity_hate
14587,26869755dfdefd8b,"Who makes personel attacks? This users always insults me, he always said I have said I am proud of being anti-seminist? Where is your justice, please warn other users not only me!",0,0,0,0,0,0
85950,e5e5dcbc6d79e1c6,"Watch the user Theredpenofdoom  

Watch the user theredpenofdoom . 
See the redmarks. He is vandalazying the whole wikipedia.",0,0,0,0,0,0
54113,909424796ed73175,"Expansion of matter
Actually editor 161.28.196.13 was attempting to make a pretty good point, though it was somewhat unpolished.  I think what he was trying to point out was that the dimensions of quantum particles are determined by fundamental constants which are thought to be stable over time.  That is, a proton today has the same radius it had when it was created.  I don't think the article's phrase expansion of space and matter intended to mean that these particles are a different size than they were previously, but it is unclear and could be construed that way.  So a rephrase of that statement would be beneficial.",0,0,0,0,0,0
117485,73b7ab0d242193bc,"""

""""Full protection"""" means...?

At 20:23, 3 October 2014 you fully protected Thefederalist.com‎. I understand this means it can only be edited by admins, but I'd like some clarification as to what that means. I understand that (a) admins can do housekeeping edits, (b) make edits required by policy (e.g., remove actual BLP vios) or (c) make non-controversial edits requested on the Talk page. But does the admin bit mean an admin is free to (d) work on a protected page as if it were not protected?   """,0,0,0,0,0,0
19530,33983ff522219d50,""""""" cellpadding=""""2"""" cellspacing=""""5"""" style=""""""",0,0,0,0,0,0
97248,08463126a158e882,"""
Wow. The article says, """"other hypotheses have been suggested."""" The references I provided support this. The article says, """"One such hypothesis"""" is the solar variation one. The references I provided support this. Quite frankly, this has reached the high school level of dissecting sentences. It would be much better for you, and for the sake of not continuing this ridiculous argument, if you just conceded. You misunderstood what the article was saying, and that's fine. Just leave it at that. ~ """,0,0,0,0,0,0
11778,1f2456d93f205b75,"Yes; more to the point, I have access to a copy of Thucydides. What I said was that Thucydides does not mention the foundation of Msssalia, or any date; he doesn't (although as I also said, he does mention the presence of Phocaeans in Massalia, but there are much better sources for that: Herodotus or Diodorus).",0,0,0,0,0,0
79245,d4194c48a5479e6e,"Thanx 

Thank you for your help in my question 'The Effects of Music on Plants' I really appreciated it.",0,0,0,0,0,0
47692,7f668a8944200509,"Your  Application 

Dear HammerHeadHuman,

Thank you for applying for  (VP). As you may know, VP is a very powerful program, and in fact the just released  has even more power. Because of this we must uphold strict protocols before approving a new applicant. Regretfully, I have chosen to decline your application at this time. The reason for this is that I dont think you have enough experiance with vandalsim. Please note it is nothing personal by any means, and we certainly welcome you to apply again soon. Thank you for your interest in VandalProof.  (talk • contribs • )",0,0,0,0,0,0
121541,8a49d8d9a4dba720,"""

Fair use rationale for Image:321b.jpg

Thanks for uploading or contributing to Image:321b.jpg. I notice the image page specifies that the image is being used under fair use but there is no explanation or rationale as to why its use in Wikipedia articles constitutes fair use. In addition to the boilerplate fair use template, you must also write out on the image description page a specific explanation or rationale for why using this image in each article is consistent with fair use. Suggestions on how to do so can be found  here.

Please go to the image description page and edit it to include a fair use rationale. Using one of the templates at Wikipedia:Fair use rationale guideline is an easy way to ensure that your image is in compliance with Wikipedia policy, but remember that you must complete the template.  Do not simply insert a blank template on an image page. 

If you have uploaded other fair use media, consider checking that you have specified the fair use rationale on those pages too. You can find a list of 'image' pages you have edited by clicking on the """"my contributions"""" link (it is located at the very top of any Wikipedia page when you are logged in), and then selecting """"Image"""" from the dropdown box. Note that any non-free media lacking such an explanation will be deleted one week after they have been uploaded, as described on criteria for speedy deletion. If you have any questions please ask them at the Media copyright questions page. Thank you. —  '''''' | =/\= | """,0,0,0,0,0,0
6777,121069df8fba3476,"Yes, I'm well aware of that some gaters claim that gamergate is a consumer revolt, but my reading of Tutelary's comment (especially given that this is a discussion of whether or not gamergate can even be properly called a 'movement') was that these sources supported the idea that gamergate is a consumer revolt, when in fact most of them do the opposite, treating the claim with suspicion.",0,0,0,0,0,0
23904,3f216a702d79f811,but in this situation the article was written by a third party about another person.,0,0,0,0,0,0
29249,4d8ad410abe559ca,"Your latest update to United States House of Representatives, New Jersey District 7 looks good. Though I was a bit surprised by the move of the page United States 2000 Census to U.S. Census, 2000 (see discussion page there). My #3 above referred to the map placement in this page, as I shifted it. Per #1, I think that the title of the district name should be in Title Case. We're in agreement on #2.",0,0,0,0,0,0
67862,b5871846cda3a7b0,This page needs a bot to fix the ISBN numbers.,0,0,0,0,0,0
62449,a7218917ad2b677c,"Cauchy's integral theorem? 

Do harmonic functions also fulfill an analogon to Cauchy's integral theorem in complex analysis, i.e. that a line integral is independent of the path if there are no singularities?",0,0,0,0,0,0
132184,c35c9679bd26aec6,"In the foregoing verse 2:223 the word Harth (tilth) indicates that only vaginal sex is permissible in Islam, because it is from this place children are produced. The semen lodged in the womb from which offsprings come is likened to the seeds that are planted in the ground, bringing vegetation. Both of them are substances from which something else is produced.",0,0,0,0,0,0
156196,ca6d118d16748fd0,", you are a fake and a fraud as a Wikipedia editor: you delete my disagreements from you talk page!! , you have no credibility as a Wikipedia editor. , you are abusive and disrespectful!! Prove me wrong!!",1,0,0,0,0,0
120569,84f8c9db8dac7c97,"""
It's not whether they are a nation separate from other Arabs, it';s whether they are a group separate from other Arabs. In other words, those Arabs not covered by the term """"Palestinians"""". since that is a valid term. I assume you accept that? Kind of like how if something can be described by the word """"broccoli,"""" it can't also be described by the word """"rhinoceros."""" Or if some thing can be described by the word """"word,"""" it can't also be described by the word """"someplace"""". or how if a thing is a thing, it really is that thing, and not another thing. Or kind how the letter """"T"""" is not also the letter """"W"""". -) does that make sense? thanks.   """,0,0,0,0,0,0
37633,647f688ed236a157,"No it's not. The Looney Tunes all exist in other dimensions of our universe; it repeats itself from different perspectives in each galaxy. This means that the characters of South Park, the Simpsons, Futurama,  King of the Hill, and Family Guy, and all the other shows we watch on television exist somewhere else. We just have yet to make physical contact with them. It will be done soon, and all those alternate worlds will be explored, and they will explore ours, and I'll finally see him - Ohh! It will be wonderful, when the day comes! Do you not agree?",0,0,0,0,0,0
61794,a55eb076c61e36ba,"I'm curious 

Should I post responses to your post on my discussion page here or at your main account?",0,0,0,0,0,0
146685,2fed9d9cff77fc94,"(UTC)
I should have thought that asking Watt directly is in contravention of WP:Original Research.  The convention on the band's album covers is to say 'Minutemen', not 'The Minutemen', although as I found out when proposing a standard spelling for Booker T. & the M.G.'s, album covers themselves are not regarded by Wikipedia as authoritative sources.  (Booker T. & the M.G.'s spelled their own name several different ways on their album covers.)  I have no problem with the title of the article being 'Minutemen' and referring to the band within the article as 'the Minutemen'.  They are one of my favourite bands, btw.   16:10, 10 July 2008",0,0,0,0,0,0
51004,88683de4606a77c5,Hm. It's amazing that I didn't even notice the wrong acronym...(!) ) — tizzle,0,0,0,0,0,0
81529,da0d4140a4748e92,What sort of damage? What's wrong with the article?,0,0,0,0,0,0
29626,4e9680b8a90ebbc3,"""

More from [Hydrino Website]
""""They have been replicated by laboratories commissioned by BLP; these are listed on the BLP web site.""""  Where? I have searched the site, and only found the NASA paper, and quoted it.
""""It is not clear why this has not been more forthright.  Hopefully we will see these independent labs reporting their results to the mainstream journals before long.
"""" This was 5 years ago.

""""BlackLight Power is also in the middle of getting its patents granted."""" 

On Patents: 
[Forbes Magizine May 15, 2000 ]
""""The bubble began bursting in August[1999], when a federal court upheld the Patent Office's revocation of one of BlackLight's patents and the suspension of four others. The Patent Office said BlackLight's submission """"did not conform to the known laws of physics and chemistry.""""

[Forbes Magizine May 15, 2000 ]
""""This month[May 2000] a chat room called the Hydrino Study Group was abuzz over a purported wirestory saying the National Institute of Standards &Technology; validated BlackLight's claims. It hasn't."""" —Brendan Coffey  """,0,0,0,0,0,0
30603,513f2b83183c7762,"""

But, """"absolutely acceptable"""" to delete the """"brain-damage"""" messages?

[[ hopiakuta  Please do  sign  your  signature  on your  message.  %7e%7e   Thank You. -]] """,0,0,0,0,0,0
127232,a86f85b7cbeb3a9c,"""==Notability of Vintage Power Source==
 A tag has been placed on Vintage Power Source requesting that it be speedily deleted from Wikipedia. This has been done because the article appears to be about a person, group of people, band, club, company, or web content, but it does not indicate how or why the subject is notable: that is, why an article about that subject should be included in an encyclopedia. Under the criteria for speedy deletion, articles that do not assert the subject's importance or significance may be deleted at any time. Please see the guidelines for what is generally accepted as notable. 

If you think that you can assert the notability of the subject, you may contest the deletion by adding  to the top of the page (just below the existing speedy deletion or """"db"""" tag), coupled with adding a note on the article's talk page explaining your position, but be aware that once tagged for speedy deletion, if the article meets the criterion it may be deleted without delay. Please do not remove the speedy deletion tag yourself, but don't hesitate to add information to the article that would confirm the subject's notability under Wikipedia guidelines.

For guidelines on specific types of articles, you may want to check out our criteria for biographies, for web sites, for bands, or for companies. Feel free to leave a note on my talk page if you have any questions about this.    """,0,0,0,0,0,0
147837,4288b86806d56093,(don't get cheeky herehe's not and was not a god  rossp),0,0,0,0,0,0
148690,507a36b3d04bfe3c,"""
As a nonspecialist in this field, I'm wondering if anyone can explain the information presented in section starting on p.2, From The Countries Viewpoint of this source EllenCT posted. 
Although the source is arguing for more funding for vocational programs as opposed to liberal arts in light of much greater overall ROI, in order to make its case it presents ROI stats for both, and to a novice like me it seems that the stats may support the statement pertaining to ROI from subsidies in terms of tax receipts. 
In short, the table shows an ROI of 30%/yr (""""BA in English""""), and though I'm not exactly sure how that translates, given the inclusion of """"incremental jobs"""" and """"incremental income"""", etc., it does seem to represent some correlation between the subsidies and tax returns. It includes the statementBecause we are looking at the investment and return from the country’s viewpoint, all incomes are calculated at gross income, including the taxes, which flow to the government. 連絡 見学/迷惑 """,0,0,0,0,0,0
120275,83464e2050991c90,"Johnpedia 
I am not confrontational. I am not uncivil. I feel you are being extremely dramatic. Do not threaten me. If you actually want this to stop, you would not keep posting on my talk page, correct? Yes, correct. I'm not interested in this anymore.",0,0,0,0,0,0
97418,093739720f447d8a,"Turkey Wikiproject TERRORIST 
The terrorist can't support Turkey wikiproject, can't neutral.",0,0,0,0,0,0
65349,aedc3b3f8140fe5a,"""
The current lead picture is an fp in Commons. There are a few com fps too; but I don't like them much. The pictures displayed above also have some technical faults. ee """,0,0,0,0,0,0
97521,09c2b1870dc654ff,"""Hi there, thanks for leaving me a message. Thanks also for the image! I always meant to drive by and take a few, but it keeps slipping my mind. ) Kennedy (talk)  

Oh! Here's your bog-standard templated welcome message! Enjoy!

Welcome!

Hello, , and welcome to Wikipedia! Thank you for your contributions. I hope you like the place and decide to stay. Here are some pages that you might find helpful:
The five pillars of Wikipedia
Tutorial
How to edit a page
How to write a great article
Manual of Style
I hope you enjoy editing here and being a Wikipedian! Please sign your messages on discussion pages using four tildes (~~~~); this will automatically insert your username and the date. If you need help, check out Wikipedia:Questions, ask me on , or ask your question on this page and then place {{helpme}} before the question. Again, welcome!  Kennedy (talk)  """,0,0,0,0,0,0
145843,22f050e945f5cd96,"I don't log in for a day and you pounce at the page removing links and reverting to your fancruft POV. Now you are claiming Sivaji grossed 350 crore? O man, you need to see a shrink. The Hindi population is 3 times larger than the combined populations of Tamil Nadu and Andhra Pradesh.",0,0,0,0,0,0
9245,18965ed0662febe0,"Request for nomination 

Have you ever considered requesting administrative rights?  I believe you'd make a good administrator, and I'm requesting your permission to change Wikipedia:Requests for adminship/Roseohioresident from a redlink to a bluelink.",0,0,0,0,0,0
141522,f51aa2b1190357a6,"""::::Excellent )^ Yaeger, Lynn (September 3, 1996). """"Pacific overtures"""". The Village Voice (New York): p. 34.  """"...a paintit-yourself model of a soft-plastic, soft-core porn babe named Belldandy"""" ... I can't visit the cite where the article is and The Village Voice isn't the most remarkable sort for advice, however you have a good source and they are well cendicated so good job and I guess I will trust you. Now if we can just stop people from assuming the Almighty is her father and find Kosuke's words on it or in the manga to show this to people...perhaps there should be more on the slight debate as to who Belldandy and the rest of the core goddesses' father is. It is also of note that we have a good balance of positive and negative male and female reactions to Belldandy. We also may need more on the Keichi page to show what the general reaction to him is and also more recent information for both.
""",0,0,0,0,0,0
128754,b091ecddae1654ff,"=Dear Mr ANAL Retentive...
WTF are you talking about, bitch?
That was a PERFECT edit. The topic was the price of Super Bowl Rings.
What's your problem?
And, kindly apologize after you state it.
Thank you.",1,0,1,0,1,0
30043,4fc6bbd1a1a6ab70,"I consider communication is extremely important, and I've noticed it's something you take time to do. Congrats.",0,0,0,0,0,0
98360,0e24b3050bacf46e,REDIRECT Talk:Zwartowo railway station,0,0,0,0,0,0
107952,41095a8474a92f35,"Will the goons look like Harrison Ford (circa Return of the Jedi) or Ewan McGregor?  If so, please send them to my house first.",0,0,0,0,0,0
123508,94a3bab10d5a44a3,"GIE

Hey, care to join the discussion at Talk:Government in exile? Need an editor to show the pan-Blue POV.",0,0,0,0,0,0
95714,fff42defd306ad5c,"I know how much the liberal editors at Wiki HATE God...

And, I'm not really familiar one way or another with Benny Hinn's ministry. But I DO know his wife and he have RECONCILED.
So, get your facts straight....bitches!

PS His wife is STILL a babe! Compare that to FUGLY's her age
like Hillary Clinton. baha99.185.56.156",1,0,0,0,0,0
47974,802d744d171d47c1,"""
I'd tone down that response a bit.   The Morning Star can be a reliable source, but not for the assessment of the political orientation of an organisation like the EDL, certainly not without other sources  TALK """,0,0,0,0,0,0
51897,8ae74cdf1f35b432,Please format you WP:RM move on the talk page. Please read the instructions on the WP:RM page and see Talk:NO where I have done it for you. If you do not do this it is likely that you request will be discounted by the administrator who makes decision after five days on the move,0,0,0,0,0,0
102778,2600783cb3604106,"Yes, after some effort, it is on one page.",0,0,0,0,0,0
120722,85ce6f0578cd8f9f,"Image 

I looked at the caption image in the infobox, and it claimed that it was from the movie trailer. Is there anything we can do to replace that image now? It really doesn't look very nice. I'm sure there's some sort of promotional poster or SOMETHING somewhere out there.",0,0,0,0,0,0
48043,80522d82d139258e,Does the vocalist have a lisp? It kind of sounds like he has a lisp.,0,0,0,0,0,0
155079,b88dd9b4dcdb677e,"Well, it was.  And when it was, we pushed to improve ourselves, which we did.  And then we got shot down.  Very disheartening when we were told it was not to be.  I had a similar discussion about this months ago with some others here.  There are sites lower on the food-chain with nothing going for them that have had a page here since Day 1 and have never been deleted.  Meanwhile we got something going for us that doesn't involve porn or selling turkey roasters, and we were erased as quickly as possible.  And I swear, it's just people from TV.com bringing it up because we are competition.  What's worse is that there's really no group, or even a couple of independent staff members who make it a point to become versed in websites to help decide what stays while remaining neutral.  It's a very sketchy process that I think we've gotten the brunt end of.  And don't worry, I'm not going to assume that if I can convince you we deserve to be here, you'll go fight for us.  But I would like to extend appreciation for putting a fresh pair of eyes on an old argument.    17:00, 16 October 2006",0,0,0,0,0,0
21769,395d38f933730fe6,unblock request is not posting,0,0,0,0,0,0
88394,ec792cf8925132c3,"As a counter-point, see Blue screen of death. Microsoft certainly didn't coin the term - it was a colloquialism that became common usage (as with RROD) - but there's an entire article named after it.",0,0,0,0,0,0
95445,ff34255739d996ae,"Think Breast's
Think Breast's
Think Breast's
Think Breast's
Think Breast's
Think Breast's
Think Breast's
Think Breast's
Think Breast's
Think Breast's
Think Breast's
Think Breast's
Think Breast's
Think Breast's
Think Breast's
Think Breast's
Think Breast's
Think Breast's
Think Breast's
Think Breast's
Think Breast's
Think Breast's
Think Breast's
Think Breast's
Think Breast's
Think Breast's
Think Breast's
Think Breast's
Think Breast's
Think Breast's
Think Breast's
Think Breast's
Think Breast's
Think Breast's
Think Breast's
Think Breast's
Think Breast's
Think Breast's
Think Breast's
Think Breast's
Think Breast's
Think Breast's
Think Breast's
Think Breast's
Think Breast's
Think Breast's
Think Breast's
Think Breast's
Think Breast's
Think Breast's
Think Breast's
Think Breast's
Think Breast's
Think Breast's
Think Breast's
Think Breast's
Think Breast's
Think Breast's",0,0,0,0,0,0
74449,c72dd43fc4727723,"""

 Appeal 

I think your treatment of me has been a little unfair. In 7th grade, I took an SAT test without preparing for it at all, it was spur-of-the-moment, I knew about it about an hour ahead of time and didn't do any research or anything. I scored higher on it than the average person using it to apply for college in my area. An IQ test has shown me to be in the 99.9th percentile for IQ. This is the highest result the test I was given reaches; anything further and they'd consider it to be within the margin of error for that test.
My mother's boyfriend of 8 years is an aerospace engineer who graduated Virginia Tech. At the age of 15, I understand physics better than him, and I owe very little of it to him, as he would rarely give me a decent explanation of anything, just tell me that my ideas were wrong and become aggravated with me for not quite understanding thermodynamics. He's not particularly successful as an engineer, but I've met lots of other engineers who aren't as good as me at physics, so I'm guessing that's not just a result of him being bad at it. I'm also pretty good at engineering. I don't have a degree, and other than physics I don't have a better understanding of any aspect of engineering than any actual engineer, but I have lots of ingenuity for inventing new things. For example, I independently invented regenerative brakes before finding out what they were, and I was only seven or eight years old when I started inventing wireless electricity solutions (my first idea being to use a powerful infrared laser to transmit energy; admittedly not the best plan).
I have independently thought of basically every branch of philosophy I've come across. Every question of existentialism which I've seen discussed in SMBC or xkcd or Reddit or anywhere else, the thoughts haven't been new to me. Philosophy has pretty much gotten trivial for me; I've considered taking a philosophy course just to see how easy it is.
Psychology, I actually understand better than people with degrees. Unlike engineering, there's no aspect of psychology which I don't have a very good understanding of. I can debunk many of even Sigmund Freud's theories.
I'm a good enough writer that I'm writing a book and so far everybody who's read any of it has said it was really good and plausible to expect to have published. And that's not just, like, me and family members, that counts strangers on the Internet. I've heard zero negative appraisal of it so far; people have critiqued it, but not insulted it.
I don't know if that will suffice as evidence that I'm intelligent. I'm done with it, though, because I'd rather defend my maturity, since it's what you've spent the most time attacking. The following are some examples of my morals and ethical code.
I believe firmly that everybody deserves a future. If we were to capture Hitler at the end of WWII, I would be against executing him. In fact, if we had any way of rehabilitating him and knowing that he wasn't just faking it, I'd even support the concept of letting him go free. This is essentially because I think that whoever you are in the present is a separate entity from who you were in the past and who you are in the future, and while your present self should take responsibility for your past self's actions, it shouldn't be punished for them simply for the sake of punishment, especially if the present self regrets the actions of the past self and feels genuine guilt about them.
I don't believe in judgement of people based on their personal choices as long as those personal choices aren't harming others. I don't have any issue with any type of sexuality whatsoever (short of physically acting out necrophilia, pedophilia, or other acts which have a harmful affect on others - but I don't care what a person's fantasies consist of, as long as they recognize the difference between reality and fiction and can separate them). I don't have any issue with anybody over what type of music they listen to, or clothes they wear, etc. I know that's not really an impressive moral, but it's unfortunately rare; a great many people, especially those my age, are judgmental about these things. I love everyone, even people I hate. I wish my worst enemies good fortune and happiness. Rick Perry is a vile, piece of shit human being, deserving of zero respect, but I wish for him to change for the better and live the best life possible. I wish this for everyone.
I'm pretty much a pacifist. I've taken a broken nose without fighting back or seeking retribution, because the guy stopped punching after that. The only time I'll fight back is if 1) the person attacking me shows no signs of stopping and 2) if I don't attack, I'll come out worse than the other person will if I do. In other words, if fighting someone is going to end up being more harmful to them than just letting them go will be to me, I don't fight back. I've therefore never had a rea",0,0,0,0,0,0
