index,id,comment_text,toxic,severe_toxic,obscene,threat,insult,identity_hate
49788,8524113fafc89866,"Low-blow shots? For suggesting you read a guideline? Not likely - it's a serious suggestion. I'm done with this discussion with you (I should have been three days ago), as it seems you're offended by pretty much anything that is posted regardless of it's intentions or not, and really this is not serving a purpose. Nothing constructive is being acheived by continuing. I'll let another editor make any applicable NPOV changes to the section in question.",0,0,0,0,0,0
83409,df2b1936915d0f14,The editor who added that for some reason keeps re-adding it without any comment or even an edit summary. Please discuss on the talk page!,0,0,0,0,0,0
23304,3d8d816bff81b399,"deleting of comments 

is this really a discussion if people just delete the comments they don't like?  its silly you have to read the history and diff the page just to see what is happening...",0,0,0,0,0,0
4297,0b73763e7d730898,"""
There are actually four Lord Fairfaxes mentioned in this article. You have Martin's grandfather (5th Lord Fairfax), his uncle (6th Lord Fairfax), his other uncle (7th Lord Fairfax), and cousin (8th Lord Fairfax). Since the majority of this article deals with his uncle, the 6th Lord Fairfax, I've tried to disambiguate as best I can. In the prose, I've stated: """"Martin's uncle Thomas Fairfax, 6th Lord Fairfax of Cameron (known as Lord Fairfax) owned the Northern Neck Proprietary land grant, which he had inherited from Martin's great-grandfather Thomas Colepeper, 2nd Baron Colepeper in 1719."""" The 6th Lord Fairfax was known as """"Lord Fairfax,"""" so I've tried to start this out in the prose so that the reader will know it refers to the 6th Lord Fairfax. In the lede, I've rendered the sentence as: """"Raised in humble surroundings in England, Martin relocated to Virginia in 1751 to assist his uncle, Thomas Fairfax, 6th Lord Fairfax of Cameron (known as Lord Fairfax), in administering the Northern Neck Proprietary, which encompassed up to ."""" Let me know if this works.   (talk) """,0,0,0,0,0,0
103756,2b143c7f8e59d78f,"""

It is true that """"Lots of more modern arts hang without frames."""" But the Signac paintings are 100 years old. And even contemporary art in a Wikipedia article benefits from frames in their presentation to the viewer. Virtually any image benefits from lines echoing the delineation of the (usually rectangular) image. This is somewhat similar to the way scare quotes call attention to a word or phrase. The scare quotes are setting off that word or phrase for special consideration. We have a vested interest in trying to get the reader to take special notice of each image of artwork that we include in an article. If we are going to argue that Wikipedia is not an art gallery or that these thumbnails are hardly impressive in their dimensions and scarceness of detail, then why bother including images of famous paintings at all? I think we all agree that the images are all educational in an art historical kind of way. Therefore it seems like a poor move to reduce their usefulness to the reader by removing the framing lines and the emphasis those lines impart to the image.   

""",0,0,0,0,0,0
30059,4fcfa03137700159,"""
 Looks good.  Leaving links is perfectly fine for contextual purposes.  Transclusions in user and talk space is debatable.  I usually try to fix those too, but most people just leave them as well.  Thanks for taking care of it.  ―Œ(talk) """,0,0,0,0,0,0
71313,bee1b62306c3a871,"Sigh, I wish you would spend more time cycling; much more of a rewarding hobby, isn´t it?",0,0,0,0,0,0
86762,e8136969f121ebbf,"As a Rabbi I can relate to this to some degree.. it seams grace is a technical definition for 'the blessings that come from above that are not in response to good deeds'
its a necessary distinction being that, theologically blessings come for good acts whereas, these blessings stem from G-d's pure kindness. In kabbalah this distinction is common because its understood that blessings have different sources.  blessings that come from good deeds come from the level of Gevurah or Judgement which is lower than the level of Chessed or Kindness which here is called G-ds Grace.",0,0,0,0,0,0
114545,64a2ae92b6acff3d,"pink meth

There's a picture of you masturbating on pink meth, and it links to all your wiki articles. Why did you let that out publicly  xD",1,0,0,0,0,0
41828,6f9c2212d272fb18,Well you are a newby about moving pages because you did it wrong. Learn how things are done around here and it will same you a lot of trouble.  | talk,0,0,0,0,0,0
141987,f78b624060552c1a,"""

 List of recent changes 

Requested by Sarge Baldy, even though they've already been discussed extensively.

 We don't need minutia about Cromwell in the intro.
 This article is about the political meaning of anarchism """"the belief that forms of rulership are undesireable, and should be abolished.""""
 We don't need the gobbletygook about """"degrees of commonality and conflict.""""
 Please don't hide the fact that Proudhon was anti-communist.
 Proudhon details should go in the Proudhon article, not here.
 Anarchist """"schools"""" should precede all the sundry issue-oriented sects.
 Bullshit about misc. non-anarchist leftie movements don't belong in the [i]anarchism without adjectives[/i] paragraph.
 Ancap books should not be censored.""",0,0,0,0,0,0
55252,939306c3eee169c4,"""

 In the News 

In Culver City, Calif., Art and Food Turn a Nowhere Into a Somewhere By JANELLE BROWN (print version) NY Times. Verse """,0,0,0,0,0,0
33572,597dffca3cc9d301,"What up G? 

You suck, ya jackass.

No serious, get a life, and that's coming from a quasi-hermit, myself.",1,0,1,0,1,0
29054,4cfff81b9d14275d,"""

Do either of them have a source? Unless there is one, it'll need to be changed back.  Daytrippers """,0,0,0,0,0,0
80783,d81fcdf2314068f2,"""

Sarvagnya, invading the page with all the Kannada users, is a mob, not inviting Urdu and Hindi users for dialogue. As for your suggested use of Tamil, while I am flattered, I dont see the need for Tamil, especially because Tamil and Sanskrit diverged over 8k years ago, and Tamil bears no resemblance to Urdu, and little resemblance to Hindi. Bakatalk """,0,0,0,0,0,0
127745,ab457bd31bf10b60,"""One or more of the children of Sonja de Lennart appear to have engaged in a lengthy hoax, beginning around December 2007, to convince the world that their mother was a famous designer in the 1940s and 1950s (although a Google search reveals no references in any fashion or other reputable sources until 2008), including vandalism of numerous Wikipedia articles (Emilio Pucci and Capri pants articles were vandalized).

Recent news articles on Capri pants have picked up the false information (the Wikipedia article on Capri pants has been duplicated on answers.com and other reference sites), and these are being used to further the hoax.  

The """"official website"""" of Sonja De Lennart was created by her daughter, Eleonora De Lennart, in February 2008, and was serving as the """"reputable source"""" for the claim that Sonja De Lennart created Capri pants (heretofore generally attributed to Emilio Pucci) until the news articles came up in June 2008.

Users Pchip and Delennart are the two Wikipedia IDs responsible for this hoax - user Delennart began repeatedly vandalizing the Emilio Pucci and Capri pants pages on December 30, 2007 to insert references to Sonja De Lennart as the creator of Capri pants, and after other Wikipedia users instructed her that the discussion of Sonja De Lennart was not appropriate on the Emilio Pucci page, user Delennart stopped contributing to Wikipedia and user Pchip suddenly appeared in February 2008 to further vandalize the Capri pants page and to create the hoax page for Sonja De Lennart.

  """,0,0,0,0,0,0
85992,e60f0cd657cf7b08,"""==Notability of Bibliography of Mirjana Detelic==
A tag has been placed on Bibliography of Mirjana Detelic, requesting that it be speedily deleted from Wikipedia. This has been done because the article appears to be about a person, group of people, band, club, company, or web content, but it does not indicate how or why the subject is notable: that is, why an article about that subject should be included in an encyclopedia. Under the criteria for speedy deletion, articles that do not assert the subject's importance or significance may be deleted at any time. Please see the guidelines for what is generally accepted as notable. 

If you think that you can assert the notability of the subject, you may contest the deletion by adding  to the top of the page (just below the existing speedy deletion or """"db"""" tag), coupled with adding a note on the article's talk page explaining your position, but be aware that once tagged for speedy deletion, if the article meets the criterion it may be deleted without delay. Please do not remove the speedy deletion tag yourself, but don't hesitate to add information to the article that would confirm the subject's notability under Wikipedia guidelines.

For guidelines on specific types of articles, you may want to check out our criteria for biographies, for web sites, for bands, or for companies. Feel free to leave a note on my talk page if you have any questions about this.   """,0,0,0,0,0,0
60167,a105f108146c860c,What!? NO!!!!!!!!!!!!!!!!!!!!!!!!!!!!!!!!!!!!!!!!!!!!!!! So I can never edit even the simplest of miskakes out of articles!?,0,0,0,0,0,0
141860,f6ef46403de7ced0,Phew -) at least this is one thing I'm glad about. I'm suggesting that we keep the VFU running: it probably won't be back. I'm still having a wikibreak: check out Talk:Gay Niggers Association of America for details. I just swore at Chocolateboy. First time on this website ever. Time for a wikibreak. -,0,0,0,0,0,0
156054,c8562f5e82f6a881,"""

 Reply to your message about style issues and footnotes/references 

Hi! Just so you know, Template:cite news is the preferred way to cite news sources. Using the template allows us to easily modify references and easily keep all references in the same format. When editing a reference, please do not remove Template:cite news, as you did here. Also, there's no need to name references unless they're used more than once. Thank you.My way of including all references in an article is according to what I've found here and here that's close to the APA style. We are talking about footnotes that are references/citations to sources, right? Was not aware that a specific way to cite only the news, although it's a reference like any other printed source. 

Also, the reference was used twice, with the long version added at the first footnote (for example, such as this reference), and the shortened version used for subsequent mentions of the same citation (for example, such as in this case). If it matters that much for the sake of style and consistency, go ahead and change the format to one for news articles. 

Let me know if you have more questions. → ♦ talk' """,0,0,0,0,0,0
40784,6cd5ebf60199819d,", or to contribute in such an environment of hostility",0,0,0,0,0,0
84007,e0d271a23d52a477,"I think my userbox is nothing compared to the content of these users' pages. The counterpart to supporting resistance is supporting the agressor. You should have sorted these pages out long ago, with or without my userbox. A proper offer would be that you sort every userbox supporting anything and I stop worrying about mine. But still, I saw how you people deal with things. A consensus has been reached twice, the second time with adminis-traitor Viridae. As soon as the userbox was back on my page, another idiot removed it. Viridae refused to restore it and remind the idiot that it was approved. I guess that will be the case if we did reach another consensus.",0,0,0,0,0,0
7110,12f24274c750a438,"t
PHUQ OFF YOU KNOB OF CHEESE!

SALT!
PHUQ OFF YOU KNOB OF CHEESE!

SALT!
PHUQ OFF YOU KNOB OF CHEESE!

SALT!
PHUQ OFF YOU KNOB OF CHEESE!

SALT!
PHUQ OFF YOU KNOB OF CHEESE!

SALT!
PHUQ OFF YOU KNOB OF CHEESE!

SALT!
PHUQ OFF YOU KNOB OF CHEESE!

SALT!
PHUQ OFF YOU KNOB OF CHEESE!

SALT!
PHUQ OFF YOU KNOB OF CHEESE!

SALT!
PHUQ OFF YOU KNOB OF CHEESE!

SALT!
PHUQ OFF YOU KNOB OF CHEESE!

SALT!
PHUQ OFF YOU KNOB OF CHEESE!

SALT!
PHUQ OFF YOU KNOB OF CHEESE!

SALT!
PHUQ OFF YOU KNOB OF CHEESE!

SALT!
PHUQ OFF YOU KNOB OF CHEESE!

SALT!
PHUQ OFF YOU KNOB OF CHEESE!

SALT!
PHUQ OFF YOU KNOB OF CHEESE!

SALT!
PHUQ OFF YOU KNOB OF CHEESE!

SALT!
PHUQ OFF YOU KNOB OF CHEESE!

SALT!
PHUQ OFF YOU KNOB OF CHEESE!

SALT!
PHUQ OFF YOU KNOB OF CHEESE!

SALT!
PHUQ OFF YOU KNOB OF CHEESE!

SALT!
PHUQ OFF YOU KNOB OF CHEESE!

SALT!
PHUQ OFF YOU KNOB OF CHEESE!

SALT!
PHUQ OFF YOU KNOB OF CHEESE!

SALT!
PHUQ OFF YOU KNOB OF CHEESE!

SALT!
PHUQ OFF YOU KNOB OF CHEESE!

SALT!
PHUQ OFF YOU KNOB OF CHEESE!

SALT!
PHUQ OFF YOU KNOB OF CHEESE!

SALT!
PHUQ OFF YOU KNOB OF CHEESE!

SALT!
PHUQ OFF YOU KNOB OF CHEESE!

SALT!
PHUQ OFF YOU KNOB OF CHEESE!

SALT!
PHUQ OFF YOU KNOB OF CHEESE!

SALT!he",1,0,1,0,1,0
86102,e653f588e0e35661,the article source is clearly misleading information cited from a reference riddled with contradictions and flaws.,0,0,0,0,0,0
93098,f8e7e1da498ddf57,"not a crime when everybody can edit it ;)
have a nice night guys, keep that stick up your ass, heros, it looks good on yas.",1,0,0,0,0,0
106295,38bc7dc7e5ddf50e,"You bitch 

Ha ha ha. )",1,0,1,0,1,0
153560,9eca20ae268c026c,"welcome Welcome to Wikipedia, the free encyclopedia! You don't have to log in to read or edit articles on Wikipedia, but creating an account is quick, free and non-intrusive, requires no personal information, and gives you many benefits, including:
The use of a username of your choice, provided that it is appropriate.
The use of your own personal watchlist to which you can add articles that interest you.
The ability to start new pages.
The ability to rename pages.
The ability to edit semi-protected pages.
The ability to upload images.
The ability to customize the appearance and behavior of the website.
The eligibility to eventually become an administrator.
Your IP address will no longer be visible to other users.

We hope that you choose to become a Wikipedian and  create an account. Feel free to ask me any questions you may have on my talk page. By the way, make sure to sign your posts and comments with four tildes (~~~~), which will let others know who left it.",0,0,0,0,0,0
85540,e4cdba7af05d2034,"""

 Please stop your disruptive editing. If you continue to vandalize Wikipedia,  you will be blocked from editing.  talk """,0,0,0,0,0,0
95350,feed2f6e6015ad05,hey the part in there about it being named after the Walton who signed the declaration of independence is wrong. It was named after some other walton who donated a bunch of money who lived in the 1930's. im pretty sure its in the agenda,0,0,0,0,0,0
4432,0bcc392069cd91ff,"""

Just taking a stab, I'd say about 1,000,000.  Or did you mean kilocalories? —  X  S  G  """,0,0,0,0,0,0
12382,20d52a3575ee6223,Did you remove my post on the discussion page for Dog Latin too? Harry Potter spells are relevant for that article because that's obviously the most prominent use of Dog Latin in popular culture. How could you have no mention of Harry Potter incantations in the Dog Latin article? Seems to me you're a partisan trying to censor stuff that you don't agree with.,0,0,0,0,0,0
58039,9b6e9a0a3bfea26c,"she saved us all  

hello boy and girl 
she saved us from sinking in the titanic but she had a javalen stuck in her......................... they are coming",0,0,0,0,0,0
36249,60e13dd5b238f881,"""
Most recent edits have been for typos or by bots fixing minor problems. Are you referring to my recent removal of the """"amazingly"""" comment?  """,0,0,0,0,0,0
143192,fdd26e6da5dddc05,"I wound up starting basic articles on the other Dick Johnsons, in the hope that someone who knows more about them will do add to them. Also, I view having both the main and disambig page are good things.",0,0,0,0,0,0
41521,6ebbfc12c0812148,"SSP 

arent the Scottish socialist party marketed as an alternative to the majority of Trotskyist socialist party's in the uk ? and couldnt it be argue that they and the SWP the main troyskyist party in the uk do not always get on, can I see a reference for them being included in the European section ? 89.241.192.58",0,0,0,0,0,0
60603,a23cbd86a9a93e7e,I an siting the show's closing credits.  Prove me wrong. 67.149.207.206,0,0,0,0,0,0
118518,79590c224c7c06eb,"There are several that seem appropriate, but, as above, this is not an article about scholarship on the Cold War, but an article about the Cold War itself; scholarship of all sorts, traditional or not, should be allowed if reliable and germain.",0,0,0,0,0,0
142428,f9daf9bac425699b,"""Carl_Paladino&diff;=388097440&oldid;=388080941 October 1], and again on October 2. On Linda McMahon, you have a long history of editing and edit warring on the page, and probably would have been blocked if Malinaccier hadn't protected the page on September 17; your October 1 and October 2 edits are inadvisable due to your history on that page, but I'm not really concerned with those since the things you reverted are borderline vandalism. Therefore the main motivation for the current block was your final edit to Carl Paladino.    ♦ ♣ ♠ 
I'm not sure I buy two reverts in two days as disruptive edit warring. Moreover, the combination of low speed and non-explicit warnings are concerning. Certainly, the articles in question attract people writing for differing political agendas, but I'm not aware of any specific sanctions/enforcement which apply to these articles at the moment.   
Sir - my """"history of edit warring"""" was basically two years ago.  20 total edits on a page [Linda McMahon]] which another editor has over 800 edits does not seem to me to show anything near an edit war.  So I am surprised to see your rationale is the Carl Paladino page!   is a legitimate edit, and not actionable at all.  is also proper, and a day earlier.  I have a grand total of 28 edits on that page, or an average or just over an edit a day also removing clear vandalism as well).  But you blocked me without any indication of my crime, and were absent for quite a while - leaving me in limbo.  Frankly, 72 hours for a person who has no recent edit war problems seems extreme.   And for this use of block as punishment - I have doubts as to propriety thereof.  Did you block because Ohiostandard kept asserting that I was edit warring?  AFAICT, he never even posted a single diff for his charge. Thank you - now can I be unblocked so I can resume normal editing?  My radiation treatment limits my activities quite a bit.  Oh - look at this sort of """"editor"""" I have had to face at ,  and a favorite example to show the kind of edits I reverted on the article.    
This looks like a bad block, and even worse when I read the explaination from the admin. Is there any """"history/involvement"""" per say with the blocking admin?   
WRT asserting that Ohiostandard 'warned me"""" - he never edited on the Paladino article, nor mentioned it to me. Right now the block is clearly punitive, and I respectfully request it be removed with a note that it was not """"edit war"""" on my part. I do not see the point in having a clear record for nearly two years - and then being blocked for a 1RR because someone """"thinks"""" I must be watched! The only connection I have with Ohiostandard is that he did not like my post about Screwball23.   
Examples of current edits from others  .  And of course the current content of """" Content of the emails in question includes video of dancing African tribesmen under the title """"Obama Inauguration Rehearsal"""", a video titled """"Miss France 2008 Fucking"""", an altered image of President Obama and First Lady Michelle Obama dressed as a pimp and a prostitute, an image of a cargo plane landing in an African desert behind a group of panicked men titled """"Run, Niggers, Run!"""" and a video portraying a woman engaged in copulation with a horse.  For some odd reason, I had thought this was actually improper on WP.  I take it that I was wrong if reverting such edits is """"edit war.""""   

 precipitating edit 

[http://en.wikipedia.org/w/index.php?title=""",0,0,0,0,0,0
70111,bb8e2291ffa2214c,", but I don't think he could replace Mercury",0,0,0,0,0,0
65692,afb65c3b085b9c58,"""
(Source with Murphy confirming that despite acknowledged similarities in their economic ideas he """"did not approach the Corbyn team"""" and describing their relationship as """"acquaintances rather than close friends""""    )   """,0,0,0,0,0,0
75174,c922d112500c82aa,"This page is bought and paid for by the US government.  It was the full time job of multiple government consultants to insure it is, was and always will remain a fantastical piece of government propaganda.",0,0,0,0,0,0
38628,6712fa63b1e0cc49,", 5 November 2005 (UTC)
I dont have to worrie about my credibility, The comments that have been posted on the ANI and other pages, by users, mainly admins, that have never, never addressed me, with what should be considered as uncivil comments, have already set my credibilty and have show that their is a complete bias aginst me, which has been futher show by the actions taken aginst me, which for site adminstration is unacceptable, and that is a fucking shame. And you actions, have only went to show that you are a part of the bias as well. I'll let me credetability speka for me in the in the information that i provied in article text, and not by the comments and actions by admins.  |  trácht ar 01:44",0,0,0,0,0,0
107229,3d3c6b17e467b27b,"Help on a page 

I am Akhamenehpour and I would appreciate help and guidance regarding changes I have made to the page on Reza Pahlavi. I admire him greatly and have added his official portrait to his page in addition to fixing some infobox. Please tell me if everything is okay and help me with the copyright on the picture.",0,0,0,0,0,0
85106,e3b75421a7d9c155,"""

Requested unblock

In addition, I would like to request that the template on my user page be removed for the following reasons:
1) the discussion of the alleged sockpuppetry involved no one but me, the suspecting administrator, and a user with whom I was at odds due to vehement discord on the talk page of the 2008 war's article. No third party, uninvolved, participant took part in it.
2) On the CU page the checkuser reached the conclusion inconclusive. Notwithstanding, Template:sockpuppeteer has been inserted into my user page.   """,0,0,0,0,0,0
32284,55d5eaa2c2a9e501,It's those biography and political articles you should watch out for.,0,0,0,0,0,0
43220,7360316abddb576e,Doug: What is this assault on me all about? What exactly is your agenda? It certainly is NOT about improving Wikipedia. - Benjamin Franklin 75.74.130.115,0,0,0,0,0,0
91627,f5048014354e2fb5,"""
Yes, yes, I saw that. 'Swhy I didn't revert your edit. —  (say whaaat?!) """,0,0,0,0,0,0
142133,f84c73ec147f7db7,"please stop! 

do not vandalize my page.
i will report you if so.
thank you, have a good day.",0,0,0,0,0,0
92874,f850d42e40cff985,"Dar es Saleem building collapse picture  

Hi Mohammad,
For the Dar es Saleem building collapse picture you added you need to give credit for the person who took it.",0,0,0,0,0,0
120376,83d17ae17a3f99ac,"""

 December 2015 
According to the webpage of Jay (Jay2518), """"Hi my name is Jay (Jay2518) and you know I love Microsoft Studios and Sega better than Sony Computer Entertainment, and also I love Sega and Microsoft Studios a whole lot better than Nintendo. I also love parachuting video games that Microsoft Studios and Sega will make more of these video games than Sony Computer Entertainment and Nintendo, I hope Sega and Microsoft Studios must team up making a whole lot of parachuting video games you know for sure.""""""",0,0,0,0,0,0
