index,id,comment_text,toxic,severe_toxic,obscene,threat,insult,identity_hate
73944,c5d628652de4b00b,"""

Hi , since it's a second time I'd need to respond to the same questions, I consider your previous post an attempt at trolling. Therefore FYI, I can't respond to similar questions any more later on. But only to any issues that are directly related to improving the article.
 please stop questioning other editors intelligence by """"carefully telling here"""" about how to """"understand the guidelines"""" of WP.
exactly about who are you talking about while referring to """"our"""", """"we write"""" etc.? But since you brought this """"we"""" up once again, have any of those """"we"""" that you're speaking for completed any articles that have been listed on the main page of WP? If not, I am humbly willing to offer my assistance including the article under the discussion here.
please take your concerns about """"outrageous, inaccurate, and erratic translation"""" to Encyclopedia Britannica.
regarding WP vandalism, please do not attempt to compromise the integrity of WP by replacing sourced and referenced text with unverified and false facts, the reason this article has been tagged in the first place.
for the last section, unfortunately I can't respond to comments that are personal in nature.
Thanks! """,0,0,0,0,0,0
7617,1445779000c60212,"""
Thats very decent of you to come and comment in such a way Zen and you are the bigger for that. Its a discussion more than a few feel quite strongly about - Its a sign of maturity that you saw yourself getting overly involved and took a break - you have all my respect and gratitude for your contributions to the discussion and for your comment here - best -   really """,0,0,0,0,0,0
144728,117b9ae26cda2490,"I think you'll find they are major duhhhh. Im changing the genre, its offensive and ignorant and we've had several complaints-",0,0,0,0,0,0
75901,cb10738f9b19617d,"Hi Calciumee, I'm sure you'll understand that we can't have unverifiable claims of death here, but in the meantime someone has found a source we can cite, so it's no longer an issue.",0,0,0,0,0,0
114546,64a2be70dbf5175b,The comments to the Rat trap article,0,0,0,0,0,0
123211,93265210b0aab140,"About the proposed DELETION of this article in w:pl 

About the proposed DELETION of this article in w:pl:

This is a copy of the answer to w:pl:Wikipedysta:Gaj777. I hope the template should be retired.

w:pl:Materna (herb szlachecki) 

Dear Kamil,

I am sorry to write you in English but my Polish is a shame. Your concerns seem to be write... Nevertheless if you please take a second look over the following sources I am sure that you will change your mind. As I am not a good painter, I hope that somebody else may do and upload the drawing properly.

 Materna, h. Ślepowron (odmiana) in Ornatowski.com > Indeks nazwisk > Herbarz rodowy, A. Znamierowski
 A drawing of this coat of arms (Herb Materna – inna nazwa Ślepowron odmiana Materna) is avalaible in Genealogia Dynastyczna (Search/szukaj Herb Materna).

Best regards my friend. (By the way, Happy New Year)",0,0,0,0,0,0
87303,e9974456b6c1236e,"Edge

What's up with Edge's score?",0,0,0,0,0,0
155272,bb66bcf2d55d351a,"Yeah, what the fuck is this? Get your lazy commie ass back here! As you capitalist overlord, I demand it of you!. 

Seriously though, come back soon.  04:37, Mar 9, 2005 (UTC)",1,0,1,0,0,0
72360,c1b13a32842bb05b,JIMBO SAID I COULD EDIT HIS PAGE. YOU ARE A MORON.,1,0,1,0,1,0
104692,3013d1812a3afbaa,"""
Thanks. I'll expand on what Tiptoety says. The first unblock request was declined by himself on the grounds that Miyokan was a confirmed sockpuppet of myself...and we all know where that lead. The other unblock requests were due to what we now know was a major f' up, and one which is yet to be addressed to my satisfaction. What you are seeing on the admin noticeboard is nothing more than an attempt to get rid of an adversary, and this is evident by the continual support of the editor who is responsible for that foul mouthed tirade which I posted earlier...look at Biophys' own comments from 03:50, 17 September 2008. The other thing that hasn't been addressed is why was this supposed outting done by an editor? What was the reason behind it? I know what was behind it, but does anyone else? Does anyone care? I'll tell you, it was an attempt to make people understand why certain editors hold such fringe views and they are prominently making their way into articles...such as the belief that Putin is a paedophile...a belief that was re-affirmed after  Dialogue Stalk me """,0,0,0,0,0,0
110031,4c98c593e7eaf5bf,"""

NPOV
I have tagged this article as POV because it is filled with sentences like """"The Iranian Government security forces opened fire on protesters on the Shi'a holy day of Ashura, a day """"symbolically about justice"""" and during which any kind of violence is forbidden,"""" """"Irregularities during the 2009 Iranian presidential election caused resentment among many Iranians,"""" """"outspoken political dissenters were detained.[5][6] However, dissenters continued to speak out against the Government, leading to further protests in December 2009"""" and """"Security forces opened fire on the day of Ashura, the Shiite holy day """"symbolically about justice"""", a day which any kind of violence is forbidden,"""" which do not sound neutral or objective but like outright propaganda? 

Than in the protest section, rather than reporting the events objectively, quotes are used, not from people, but from pro-reformist articles, the result: """"Protesters in Tehran gathered  """"From Imam Hussain Square to Freedom Square"""", """"from east to west along Revolution Street"""", and it was on this day that """"the political and religious symbology of Iran's Islamic regime was turned on its head"""".[10] The protesters made another symbolic move- a """"symbolic journey from a square named after its most revered hero toward a monument dedicated to freedom, along a street called Revolution.""""[10]"""" is unbelievably POV, this should be immedietly changed to a proper written text which reports everything objectively. Meanwhile in the part about the demonstrations condemning the Ashura riots (which BTW, where much larger than the Ashura riots themselfes - a fact which was completely ignored by the writers of this wiki article), """"On December 30, counter-rallies staged and organized by the government at various cities, including Tehran, Qom, Arak, Shiraz and Isfahan called for the death of the protesters, with government workers receiving the day off work in order to attend the demonstrations"""" the sentence """"with government workers recieving the day off work in order to attend the demonstrations, was added in such POV manner and clearly to discredit those demonstrations.

Now although it is mentioned how rioters set fire cars, shops, banks and power stations (though other vandalism by the rioter isn't mentioned at all), this is such small part of the article. The violence by rioters (against people) is not mentioned at all, meanwhile there is a complete section devoted to alleged government violence against the protestors. The article is also clearly written with a goal of reporting only what is good for the green movement, this is illustrated not only by the POV quotes but by for isntance the way that whenever government claims are reported, they are immedietly rebuffed with other POV claims, leading me to believe they were only included to """"expose"""" the government as liars (which is POV). An example is """"Although official sources in Iran denied involvement of security forces in killing of protesters, at least one amateur video shows, the security truck which was deliberately running over the protesters.[16] Other evidence says that security forces were armed with guns and shot at protesters, including one amateur video showing a plainclothes security force directly shooting at protesters.[17],"""" with source 16 being non-existant and source 17 being a vehimently anti-Iranian blog showing a video of a gunman, of which there is no proof he is associated with the police of basij. In the article he is however labelled as a """"plainclothes security force."""" All in all, this article definetly needs to be re-written.  """,0,0,0,0,0,0
30900,521596a7884a2bd2,"My page: Alex Kenrick 

Check out the new page and let me keep it until I can post a link to the youtube video
Thank you",0,0,0,0,0,0
142487,fa23f4b712508b6b,"Appearances
Someone changed the trivia that Hiro is one of two characters to be in every episode to three, the other being Mr. Bennet. I don't believe this is true, and if it is, it's not on the other's pages. It also doesn't validate much, it's cool but that's it. Why don't we say that Hiro is the only one to be portrayed by three actors for Young Hiro, Present Hiro, and Future Hiro? None of it really seems to matter.",0,0,0,0,0,0
103450,298e0b88a7d8c016,"New source 

http://atlanta.cbslocal.com/2014/05/17/gang-stalking-and-electronic-mind-control-community-spreads-online/",0,0,0,0,0,0
34497,5c2084ef55a78938,"""Can I please request someone with """"move"""" rights to correct the title of the page? It should read """"Ilyin"""" instead of Il'in'. It was just a misspelling, and my account is not 4 days old yet. Thanks!""",0,0,0,0,0,0
111681,556aa53d4600fca5,"WebGlobix deletion 

At first the article on WebGlobix you deleted was marked G7 blatant advertising, the next time I looked it was marked as (A7 (group): Group/band/club/company/etc; doesn't indicate importance/significance) by Orange Mike. 

I guess I should be happen that the article went from a G to an A but clearly Orange Mike doesn't appreciate the nuances of desktop virtualization. Especially a product that doesn't use Terminal Services or only transmit drawing commands and mouse events only thereby only requiring a small resource (memory/cpu) footprint. It is such a big deal that the Department of Defense uses it for its Global Command and Control processes. That is a big deal in VDI. The desktop shadowing feature is totally cool. 

We use it and I like it and that is why I think it should be included people need to know what is out there. They can judge for themselves but without information they will have no opportunity. WebGlobix is better than Citrix because we used to have Citrix and it was a pain.  Citrix is such a big deal but it is very expensive and takes a full time person just to administrate it. We have neither that kind of money or time.

Well in any event I didn't see any interaction with my comments or maybe it is because I need to login to see them but I hope when you guess hand off stuff that it is at least reviewed by someone who understand the process being discussed so they can appreciate the relevance.

At least try to go easy on the newbies...",0,0,0,0,0,0
52573,8c9f00b6068a280d,"""/Articles|Articles]]

Dreadstar's Archives
Dreadstar's Sandboxes

Defender
  The Mighty Defender of the Wiki Barnstar In recognition & thanks for your efforts in helping us work our way towards consensus towards making Battle of Washita River a good WP:NPOV (instead of WP:SOAP) article. Still a lotta work to do, but now we can do it, in no small part because of your help.   

 The royal """"We"""" 
Don't you know, """"we"""" is the term that is only used by royalty? This must certainly, therefore, be a person of royal heritage, and thus we should not """"deign"""" to remove the comments, yes? 

   I crack myself up... Ariel♥Gold 

Indeed. We are well aware of the Royal We.  Henceforths, ye shall call me by mine rightful name...Lord Dreadstar, master of my domain...I was also thinking of them being the 'toddler' wee...wee wee wee, all the way home...;)  You crack me up too...:-D   † 

We curtsy to your Royal Highness, M'Lord, and we just must say your ascot is most fetching! We are exceedingly pleased. I therefore, hereby award you the title of """"Lord Dreadstar, Master of my domain, Earl of Fashion. And should you need any assistance, at any time, we would be most honored if we could assist you. Lady♥Ariel 
Lady Ariel is most pleased with your approval! Ariel♥Gold 

Thou art most gracious, M'Lady Ariel. I most happily accept the title thou hast bestowed upon my humble self.  Thine heart is truly placed in the most appropriate position, at the very core of thine name, for all to behold!  Mine ascot is most pleased to have been the focus of your divine attention, and mine sword is most jealous...!  

I am yours to command, shouldest thou have need of mine prowess with the edit summary of justice...!  - ''''' 

I'm sorry, lol, I just have to get out of the whole """"in voice"""" thing for a second to just tell you that I rarely truly laugh in RL when reading anything online, or watching TV or what have you, but honestly, your last reply made me literally and figuratively, laugh out loud. 

I simply could not be more amused!  And seriously, I meant it, although I doubt there's anything you'd ever need silly little insignificant me for, I'm more than happy to assist in any way you need, and I'll certainly take you up on your offer of assistance should I ever run into a wall that is only permeable by the Mighty and Powerful Lord Dreadstar, Master of my Domain, Earl of Fashion, Keeper of the Keys of Justice'''''. Your most humble servant, Lady♥Ariel 

Why thank you, Ariel♥Gold! That is one of the finest compliments I've received..it made me laugh out loud with delight!  It's actually kinda rare that I can use my sense of humor on Wikipedia, in RL I'm known for my prowess with the dagger of delight and the lance of l",0,0,0,0,0,0
133106,c819ff4a6ce5cce6,"nixie, part 2 

You banned me after you warned me because I was making to much sense to your lover. You are very unfair.",0,0,0,0,0,0
155034,b7f7fa2eda65730f,"You appear to have a rather warped view of things, please read texts more carefully and look for reliable secondary sources rather than imposing your own preconceptions. Unless you've specific proposals for article improvement, your comment appears to be offtopic soapboxing, . . , talk",0,0,0,0,0,0
114173,62d53c0fd6fddaf4,It's my damn page and i can do what i want. Buzz off,1,0,0,0,0,0
155563,c009deaff27c3031,"""
 Your submission at AfC List of Downton Abbey Deaths was accepted 
 List of Downton Abbey Deaths, which you submitted to Articles for creation, has been created. The article has been assessed as List-Class, which is recorded on the article's talk page. You may like to take a look at the grading scheme to see how you can improve the article.
You are more than welcome to continue making quality contributions to Wikipedia. .
 If you have any questions, you are welcome to ask at the help desk.
 If you would like to help us improve this process, please consider .
Thank you for helping improve Wikipedia!
Feudalist  """,0,0,0,0,0,0
51920,8afaa176d2f6f841,"Perform a fine job on my eager member==

I assure you, my seed is considered wegetarian if you will please swallow it all. Then you may gratify your own needs, and consume your own curry scented seed. Thank you please! 

==",0,0,0,0,0,0
35216,5e0d25d6b0ebe597,"Deletion of a sub-article 
, spun out of this article in February of this year, is now listed at Articles for deletion.",0,0,0,0,0,0
132710,c5fc1be72dacfdc7,That guideline has been largely dismissed. The year in front naming convention is only useful for repeated events.,0,0,0,0,0,0
32420,564150ce96af273e,both of you are tools go fuck yourselves and get laid,1,0,1,0,1,0
87840,eafae00f227d02f0,"This article could be improved if someone added details such as the name of the home ground, the current manager etc.",0,0,0,0,0,0
19658,33ef68b872bfe7b1,"""
This is an interim measure. If the consensus changes it can be undone. BH """,0,0,0,0,0,0
83334,def610860c424c7f,"20:49, Jun 23, 2005 (UTC)",0,0,0,0,0,0
28443,4b4dc7d4baab07d2,"}}

My comments against Leithp were constructive. If they caused offence, I apologise",0,0,0,0,0,0
79060,d3983ba2411cbc69,"I've removed the following, because it doesn't sound like an encyclopaedia:

Another view.

This is a totally honest album, Lauryn has hit highs here that can only be achieved a few times in an artists lifetime. It is inspiring, thought provoking, honest, deeply spiritual and completely enjoyable just to listen to even with out an spiritual dimension. Go Lauryn, my prayer for you is that you can weather the storm of ignorant criticism that comes from this CD and that you will give us some more of the same. God Bless",0,0,0,0,0,0
22420,3b338193639efaa4,Good call.  That's where I'd put it. -),0,0,0,0,0,0
21908,39baf127753adca0,"Article length is not irrelevant because featured article criteria require that an article is of appropriate length.  Surely you'd agree that if Jenna Jameson = Gandhi then one of them is not of appropriate length?  So the question is which one.  Frankly, very very few people will read all of an article that's longer than 32kb unless it's on something of crucial importance to science, history or the arts.  If you write 100kb on a Canadian regional politician (and that is a truly terrible article), or 60kb on a porn star, then unfortunately I fear that your time has not been well spent because few people will read the article.  If it was 20kb long, it would have a much more enthusiastic readership, and you could have written at least five very good 20kb articles in the time it takes to do one very good 60kb article.",0,0,0,0,0,0
151573,7f557681b42329e3,"Despicable Me 

No, of course the creators do not say that Gru resembles Grimly Feendish. But look the pictures on the wiki page and it's obvious, in the same way that Feendish resembles Fester from the Addams family. This is not a criticism, merely an observation and should stand.",0,0,0,0,0,0
75971,cb4cce525457ef15,"""I changed this to """"science fiction"""" as space opera seems the wrong categorization to me, and as the article on space opera describes that genre as emphasizing romantic adventure, interstellar travel, and space battles, none of which are main elements in Starcraft (though one must assume that interstellar travel takes place, and there are a few space-station battles).  If anyone can help me out with a better subgenre, I'd appreciate it, but the assignment of the game to space opera seems highly specious  (though perhaps there's something I'm missing?).
 

""",0,0,0,0,0,0
59895,a05e2ab818feb44b,"""

Look, buddy. You need to stop trolling. Add your e-mail on a billboard for all I care. Just don't put it on my talk page. I won't be e-mailing you anytime soon! ←Signed:→Mr. E. Sánchez '''''' / Talk to me!←at≈:→ """,0,0,0,0,0,0
77944,d0b106a7105850d2,Katie Holmes needs her own section. I am too lazy to do it.,0,0,0,0,0,0
16657,2becb032f49596c7,"""

 Yellow Kid scan 

The text of scan of the full page """"Yellow Kid"""" is ... well, almost unreadable.   The .jpg file format is simply inappropriate (due to lossy compression artifacts).  Can you please replace this with a scan in PNG format (PNG uses a lossless compression method, so preserves the details of the scan, especially text, MUCH better than a JPEG file.   76.243.106.37  """,0,0,0,0,0,0
141850,f6e13c928000f291,"""

I have provided sources but you ignore them.Malke2010 """,0,0,0,0,0,0
101129,1d48b043e8394050,", 29 October 2009 (UTC)
Varsovian...after thinking about your comment for a while...if I asked for an unblock, would you support me??  17:01",0,0,0,0,0,0
50113,85f1f2987548ce74,How do I become an editor?,0,0,0,0,0,0
63063,a8b522facd9cf8bf,"""

 Blue-collar roots? 

Adam's IMDB mini-biography says """"[h]is mom was a sex therapist and his dad was a psychologist"""". While he did apparently have blue-collar jobs, if IMDB is correct I think it is misleading to say he came from blue collar roots.""",0,0,0,0,0,0
48879,82b078b43897d67f,Additional odd comments Mr Babloo Loitongbam who is quoted self-referentially as a good egg was outed in a 2014 Indian Intelligence Bureau report as a paid agent of foreign governments who uses his fake NGOs to organize fake human rights campaigns to favour one multinational over another for oil and mineral extraction rights. One of his fronts JPF in 2013 announced they would be breaking all links with Sharmila in lieu of providing audited accounts of how they had been spending Sharmila's prize funds and also accused of using the tax free status to money launder for Mr Loitongbam. No one reading finds new information however as Mr Loitongbam is a sad self-publicist I am sure he appreciates the cover up wiki editors are doing for him. if he isn't paying you then you are stupid as well as uninformed. Desmond Coutinho still not idea what you mean by this is unsigned. The other errors and misinformation are minor.,0,0,0,0,0,0
150720,70ebeaf171aa18e4,"""
Do your own homework, rather than blocking someone and then tuning around and asking for their help. My god, do you know shit about real life ?   ☏ 00:15, 22 Jun 2012 (UTC)""",1,0,0,0,0,0
13475,23910313efe76f80,"""

 recent blocked user 

User talk:Scrotey McBoogerBalls i think just asked to have his talk blocked Monarch (D•R) """,0,0,0,0,0,0
52047,8b4a19e58453da45,Thank you very much. I appreciate it.  And thanks for all the userful links.,0,0,0,0,0,0
12214,2055c485013bfd04,"3RR WARNING
 You currently appear to be engaged in an edit war. Note that the three-revert rule prohibits making more than three reversions on a single page within a 24 hour period. Additionally, users who perform a large number of reversions in content disputes may be blocked for edit warring, even if they do not technically violate the three-revert rule. If you continue, you may be blocked from editing. Please do not repeatedly revert edits, but use the talk page to work towards wording and content that gains a consensus among editors. If necessary, pursue dispute resolution.",0,0,0,0,0,0
83471,df53b3aa0e1af238,"""Special:Contributions/75.70.99.101|75.70.99.101]]  

Umm, he shouldn't be categorized as anything specifically, as is how they've generally done it with all prominent people who didn't leave enough information on wikipedia.  And Madison is often considered to have been a straight-up atheist privately by historians - but that's kind of the point, that it's still very unknown, though he clearly rejected standard theism.  I'd be inclined to consider him a deist (which, btw, should not be capitalized) but it is not a religion, nor does it say anything about other beliefs that would encompass a religion.  98.168.192.162  

Actually, the word could just be changed to """"religious belief(s)"""" - rather than simply """"religion"""" as it stands - or something similar, and for that, I think """"deism"""" could be used since it's seemingly the most accepted stance he had (or am I wrong)? `98.168.192.162  

The word's from the template (which is outside this topic).   

I read somewhere that he was an Episcopalian.  —Preceding unsigned comment added by  (talk • contribs)  

 Redirect 

Just so everyone knows, Madison does not redirect here, despite what it says at the top of the article.  
I have removed that template, thanks. — (Talk) 

 Dubious 

Someone needs to rewrite the War of 1812 heading - """"British insults"""" """"hostile indians"""" """"american's didn't really want canada"""" - come on, lets see some neutral and TRUTHFUL info. Sure the British were impressing """"American"""" subjects into the Royal Navy and the NATIVE AMERICANS were at times hostile but the Americans weren't saints. To be honest the War of 1812 was one of the biggest disasters America has faced - their invasion of Canada bloodily repulsed, Native Americans supported by the British and Canadians, A British Army torching Washington DC (in retaliation for the torching of York during the winter season) and ending up marching at will around central america doing what they wanted until a peace treaty was signed. American prestige was only """"restored"""" after a meaningless battle in New Orelans AFTER THE WAR ENDED. Regardless of what people say, this war did not prove Young America could hold their own against the old world, it showed they bit off more than they could chew in attempting to subjugate and forcibly liberate Canada against the populace's will. Don't forget half the canadian population were loyalists during the American revolution and Britain was fighting the might of Napoleon in Europe, so the War of 1812 was something of a sideline campaign. I may have rattled on a bit here butI think it just goes to show that that section needs rewriting to seem something other than some super-american-patriotic propaganda machine.  —Preceding unsigned comment added by 86.136.246.144   

""""Meanwhile, British naval officials tried to recover their losses of sailors by capturing Americans. From 1803 to 1811 the British navy illegally impressed some six thousand American sailors,"""" from Steven M. Gillon and Cathy D. Matson, The American Experiment: A History of the United States Vol. 1, 2nd ed.  Page 314.  —Preceding unsigned comment added by 76.6.83.252   

 More on Madison's Notes 

While Madison's vital role in the Convention is addressed, I feel not enough attention is given to his role as the primary (although unofficial) note-taker of the Convention. It is mentioned later on, in the section disscussing his later life, but never brought up in the """"Father of the Constitution"""" section, when his roles as a speaker and in developing the Virginia Plan are mentioned. I feel it deserves mentioning, since Madison's notes are th",0,0,0,0,0,0
