index,id,comment_text,toxic,severe_toxic,obscene,threat,insult,identity_hate
80686,d7dc7dc2d21b0571,"Hehe, just realized that the more successful someone is at doing CSDs and PRODs, the less edits they have over time, because all their edits get deleted ;)",0,0,0,0,0,0
3043,083864c4df3f7123,BTW: Please reply here. I've watchlisted it. °Talk,0,0,0,0,0,0
51092,88a853481a438bd3,"can you review this 

http://en.wikipedia.org/wiki/User:MouthlessBobcat/sandbox",0,0,0,0,0,0
75184,c927dc919c183e05,"""

{{unblock|1=
Ruslik0 is incorrect in his block of me. I wasn't edit waring as defined by Wikipedia: I made one reversion of an edit today.

Furthermore, Ruslik0 is incorrect that I made a false accusation regarding the objective fact that Jeffro77 is engaging in vandalism: Jeffro77 replaced this entrywhich is very similar to the version that existed there since October 31, 2008, with some improvementswith this entry, giving the excuse in his edit summary of """"WP:FRINGE,"""" which doesn't even make sense as an explanation for his edits: i.e., deletion of a number of citations; deletion of the information on theologian Prof. Wolfhart Pannenberg's defense of the theology of the Omega Point Theory; etc. As well, there's no need for the large displayed quote, as the previous entry already stated that Prof. David Deutsch doesn't agree that the Omega Point is God; furthermore, Jeffro77's edit deletes the mention of the fact that Prof. Deutsch endorses the physics of the Omega Point Theory.

In addtion, Jeffro77's edit isn't even literate, as he give the following mangled citation to Prof. Deutsch: """"Chapter 14: """"The Ends of the Universe,"""" with additional comments by Frank J. Tipler; also available here"""". Whereas the version before was properly cited: """"David Deutsch, The Fabric of Reality: The Science of Parallel Universes—and Its Implications (London: Allen Lane The Penguin Press, 1997), ISBN 0713990619. Extracts from Chapter 14: """"The Ends of the Universe,"""" with additional comments by Frank J. Tipler; also available here and here.""""

As stated above, Jeffro77's excuse in his edit summary doesn't even make sense, as it doesn't explain why he would delete mention of Prof. Deutsch's endorsement of the physics of the Omega Point Theory, particularly since Jeffro77 himself called Deutsch an """"eminent physicist"""" in his own edit (i.e., that statement wasn't there before): of which argues against the notion that Jeffro77 considers the physics of the Omega Point Theory as fringe. Further, Jeffro77 deleted mention of the fact that Prof. Wolfhart Pannenberg, who is one of the leading theologians in the world, has defended the theology of the Omega Point Theory and Tipler's position that the Omega Point is consistent with the Judeo-Christian God.

Additionally, while Jeffro77's """"fringe"""" claim's aren't even relevant to his edit, they have already been refuted numerous times. Indeed, Jeffro77 himself refutes this claim in this very edit of his: to state again, therein Jeffro77 himself called Prof. Deutsch an """"eminent physicist"""" in his own words. So obviously Jeffro77 himself must consider Deutsch's endorsement of the physics of the Omega Point Theory to be noteworthy, and yet he deleted this endoresement in an area where Jeffro77 himself agrees that Deutsch is eminently qualified and replaced it with a large displayed quotation regarding a matter that Deutsch has no qualification or erudition in, even though the previous version already clearly mentioned that Deutsch disagrees that Omega Point is God. Moreover, in this edit Jeffro77 deletes all mention of the fact that an actual trained theologian, Prof. Wolfhart Pannenberg, who is one of the world's leading theologians, has defended the theology of the Omega Point Theory.

As well, Prof. Tipler himself has defended the theology of the Omega Point Theory and his identification of the Omega Point as being God in a peer-reviewed academic journal: see Frank J. Tipler, """"The Omega Point as Eschaton: Answers to Pannenberg's Questions for Scientists,"""" Zygon: Journal of Religion & Science, Vol. 24, Issue 2 (June 1989), pp. 217-253. Regarding the physics, Prof. Tipler has published his Omega Point Theory in many peer-reviewed science journals, including a number of the leading physics journals such as Reports on Progress in Physics (one of the world's leading physics journals) and Monthly Notices of the Royal Astronomical Society (one of the world's leading astrophysics journals). The Wikipedia article on the Omega Point Theory lists seven different mainstream peer-reviewed scientific journals in which Tipler's Omega Point Theory has been published (and that's not including the Zygon journal). That is quite a significant amount.

Jeffro77 is out of",0,0,0,0,0,0
116480,6ea52baf99e97f8a,Why is Wario the featured article,0,0,0,0,0,0
133250,c8edbec909892107,Gogo blows man’s thick cock then gets on all four for fuck from behind like a little bitch in heat,1,1,1,0,1,0
55466,943b985b13e5168b,"""

Speedy deletion of Blackstar1985
 A tag has been placed on Blackstar1985 requesting that it be speedily deleted from Wikipedia. This has been done under section A7 of the criteria for speedy deletion, because the article appears to be about a person or group of people, but it does not indicate how or why the subject is notable: that is, why an article about that subject should be included in an encyclopedia. Under the criteria for speedy deletion, articles that do not indicate the subject's importance or significance may be deleted at any time. Please see the guidelines for what is generally accepted as notable, as well as our subject-specific notability guideline for biographies. 

If you think that this notice was placed here in error, you may contest the deletion by adding  to the top of the page that has been nominated for deletion (just below the existing speedy deletion or """"db"""" tag), coupled with adding a note on the talk page explaining your position, but be aware that once tagged for speedy deletion, if the article meets the criterion it may be deleted without delay. Please do not remove the speedy deletion tag yourself, but don't hesitate to add information to the article that would would render it more in conformance with Wikipedia's policies and guidelines. Lastly, please note that if the article does get deleted, you can contact one of these admins to request that a copy be emailed to you.     """,0,0,0,0,0,0
107070,3c7ad19b357a9951,"Calvin Cheng

Anonymous vandalism is continuing.",0,0,0,0,0,0
136152,d84a9e582e4c7f0f,"I need your help 

I need your help on the Hazara people article. The article was nominated for good article status and it is very close to passing, but the reviewer has placed its passing on hold because first he wants  some changes. He has listed the changes he wants on the talk page of the article. Please review them and fix the things that he requested. I would do it but I don't have time right now. We have 7 days to make these improvements listed. Thanks.",0,0,0,0,0,0
9464,191a2db6d578c322,"Filipinos 

So I see you're a big fan of Trindad Pardo de Tavera? Well do this Wiki a favor, and instead of keeping him in the Filipinos article why don't you actually complete his bio speaking to the fact that its empty on the last section.

Tavera did NOTHING significant to Filipino history, and clearly you only put his picture because he's of European descent as if you haven't already done so for everybody else. 

Clearly all of your edits are biased on a religious and ethnic sense, and all of your edits include Mestizos and five Catholic priests.   PacificWarrior101",0,0,0,0,0,0
44647,774f7d6c390b2ada,Who cares asshole? Stop terrorizing wikipedia users with your stupid questions!,1,0,1,0,1,0
147505,3d5c8e66ad91b530,"""

 Hey  

Whats Up?
  1  """,0,0,0,0,0,0
139479,ea92cecd6de3807d,"""
He did write a book about all this stuff, so its not like """"Bob"""" was trying to hide the truth.  And his very public arrests AND cheating on his wife are kinda hard to hide, too.  No need to sugarcoat the dead - they don't care anymore.   """,0,0,0,0,0,0
154760,b2ec215dd82e5df3,Why why why would the school's phone number belong on this page?!?!?,0,0,0,0,0,0
12453,2106860558b33a6b,"Plagiarism by www.lakersplayers.org
Since I have received no response from the www.lakersplayers.org web site administrator and they have made no attempts to attribute their source, I am noting here that the site

http://www.lakersplayers.org/gail-goodrich.php

has plagiarized this particular wikipedia article.",0,0,0,0,0,0
14974,279796bb2d22fe3b,"I have a final warning?
Can you please answer one question at a time to avoid a vague politically correct postmodern answer, thankyou. I have already spoken to admin friends on how to report your behaviour just to let you know they will be reading your response, thankyou.

1/ Final warning? Where are my previous warnings for you to issue me with a final one?
2/I did not launch a personal attack and I already have full support on this. I assume your first language is English, therefore I would like for you to tell us how me agreeing with Timothy Titus that this Bot owner may indeed me lying about his student status discovered through his poor use of English, hense the poor management of the bot is a personal insult?

Please take your time in responding to us and pick your words carefully so we can fully understand what you are trying to do here.  Thankyou for your time.",0,0,0,0,0,0
126223,a310fabe315b384c,"""

If none of them are linked/transcluded to any other article, then there won't be any problem with deleting them.  Have fun deleting )  ''''''(talk) """,0,0,0,0,0,0
137646,e08d31cd5b28f3d9,"Voigt 

Out of curiosity, what about the material you removed from the Voigt article struck you as POV?|Talk‽ 20:19, 27 Jun 2004 (UTC)",0,0,0,0,0,0
42300,70e2553ed5e2227f,"""
Well I think abusing is maybe too strong a word anyhow, and besides, I go along supporting it's use anyhow, so I'm just as bad. I just thought that where you can draw one yourself and publish it free, that would count as a free alternative. I've been too lazy to look it up or ask so I don't really know, I guess we can ask at the help desk or something. Hey how about the teahouse, there's fun right there, I'll pretend to be a new editor like mir does all the time, lolz, how about it ?   ☏ 15:56, 21 Jun 2012 (UTC)""",0,0,0,0,0,0
99587,14c6c69e307e8dda,I have already learned - may be you not yet - that one can not insult soulless people.,0,0,0,0,0,0
149714,605067c589fae77d,"""

Speedy deletion of REPENIQUE
 A tag has been placed on REPENIQUE, requesting that it be speedily deleted from Wikipedia per speedy deletion criterion A1. 

Under the criteria for speedy deletion, articles that do not meet basic Wikipedia criteria may be deleted at any time. Please see the guidelines for what is generally accepted as an appropriate article, and if you can indicate why the subject of this article is appropriate, you may contest the tagging. To do this, add  on the top of the article and leave a note on the article's talk page explaining your position. Please do not remove the speedy deletion tag yourself, but don't hesitate to add information to the article that would confirm its subject's notability under the guidelines. 

If you think that this notice was placed here in error, you may contest the deletion. To do this, add  on the top of the page (just below the existing speedy deletion or """"db"""" tag) and leave a note on the page's talk page explaining your position. Please do not remove the speedy deletion tag yourself.  """,0,0,0,0,0,0
52194,8ba3deb66e03de0e,"Also, did you copy the C-201, C-202, and C-207 from somewhere?",0,0,0,0,0,0
25070,425659f2e990f662,"Might find something in Aichi 99 Kanbaku 'Val' Units: 1937-42 By Osamu Tagaya (link is partial Google Books sample). Another reference with some ship details, including Admiral Halstead, an American cargo vessel loaded with 14,000 drums of aviation gasoline, was strafed and had her plates sprung by near hits but escaped more serious damage. (think of that going up) is Combat Narrative—The Java Sea Campaign—JAPANESE AIR ATTACK ON DARWIN FEBRUARY 19, a 1943 report of the Office of Naval Intelligence, United States Navy.",0,0,0,0,0,0
17880,2f34f0a0f32a9d52,. In that period time armenian does not even now there is Garabakh territory on the map,0,0,0,0,0,0
149486,5cbcc78a836859ae,"Lemme ask this, if I'm talking about a ratio between 1 and zero, then is what I'm talking about dividing by zero, which is perhaps the central paradox of my conundrum? (Not to mention, why it doesn't fly here)",0,0,0,0,0,0
126188,a2d8b7de0e82457c,"""
  The Original Barnstar For the letup in stupidity   """,1,0,0,0,0,0
152250,8a3833a0d31aee8f,"""
Amy Winehouse
The Advocate article that I inserted as a reference into the Amy Winehouse article has Winehouse describing herself as """"bi"""". Why did you take issue with it as a source?   """,0,0,0,0,0,0
75495,c9f1ce33eed0a64c,", 27 May 2009 (UTC)
Ah, thanks. Silly bot, archiving this garbage.   13:26",0,0,0,0,0,0
12828,2200cfa2ff63b560,Don't you have anything better to do???????,0,0,0,0,0,0
59926,a06c9e83d935aa1e,"""

I'm sorry if I gave you the impression I was an admin; I'm not. =) I'll reiterate what I've said above that this isn't a personal issue, and I have no problems with these articles existing some day, but in their current form I think it's a bad thing. If/When I tag them for AfD, I'll have to tag each individual page as well, so you should notice on your watchlist if you have these there in case you want to try and argue to keep what there is. — (talk) (e-mail) """,0,0,0,0,0,0
114067,623813da7375d66c,The Finnish vandal was here.,0,0,0,0,0,0
91982,f5e83ac36cdabed2,"(I forgot to sig, and changed the top the An Ethics of Dissensus, interesting concept, interesting article history)",0,0,0,0,0,0
152964,95521b1cba34ae7e,"""

 My Conrtibutions to Shady Records 

So I've been asked to consult this page by JrPut or idk his name; but anyway:

The Shady Producers/DJ's list should be updated.
I have valid links for Mr. Porter, Alchemist, Rikanatti, and Luis Resto. The following are all Reliable links, and even though Aftermath Ent. Blog is a blog, we have used it as multible sources on additional articles, and we have also used MTV News as a reliable source, and that in itself is a blog.
 Alchemist 
Luis Resto
Rikanatti
Eminem also acts as a producer for the label, and since he is the founder, CEO, and signed to the label as its main artist, I would presume that linking references for him as a producer is frivalous and uneeded. 

Now, The Bass Brothers and Eminem have ended their working relationship. We have multible sources for this including when Em purchased his new studio, and F.B.T sued Interscope/Aftermath.

However, with that said, we have no additional proof that DJ Head has ended his working relationship with EM. We have no source saying that he has, and unless you supply one, we're going to be leaving him in the active section. Just because a producer didn't release any tracks for the label in a while does not constitute their absence from the label.

So Please, Let me re-add Alchemist, Eminem, Mr. Porter, Luis Resto, Rikanatti, and DJ Head to the production list, and let us move on with our lives. No need to keep pricking this crap in the butt.

Also, """"DJ Green Lantern"""" should not be under the """"former artist category."""" If you leave him there, you're going to have to add the other Producers/DJs onto said list when and if they leave the label.""",0,0,0,0,0,0
62950,a86685e58d4c4871,"Numbers
Stop adding arbitrary numbers to politicians.",0,0,0,0,0,0
96228,02b5db357691645d,Can someone please help me. I am conistently being harrassed by his user and he is abusing his authority to accuse me of things I have not done. He has a personal gripe with me.,0,0,0,0,0,0
120648,855d81c59bd38b32,"Thanks for experimenting with Wikipedia. Your test worked, and has now been reverted or removed. Please use Wikipedia:Sandbox for any other tests you want to do, since testing in articles will be reverted quickly. Please see the welcome page if you would like to learn more about contributing to our encyclopedia. Thanks.   –  (Talk) 05:27, 10 Feb 2005 (UTC)",0,0,0,0,0,0
36360,612095cf6f230bd1,"here are some of references
nirmukta . com/2010/01/10/how-ashoka-the-great-gave-brahmins-the-gift-of-a-song-with-which-they-conquered-india/
imdb . com/title/tt0249371/
larryfreeman . hubpages.com/hub/Ashok-A-Short-Biography-of-Ashoka-the-Great-of-India
asianhistory . about.com/od/india/a/ashoka.htm",0,0,0,0,0,0
125864,a13b590ff3f0f03b,"Pyrrhus and Molossians were Illiryans, NOT greeks.",0,0,0,0,0,0
125743,a0ac7b143ec76bf4,this image thing for days,0,0,0,0,0,0
4113,0af95887109b785d,And here's a paper that suggests that Seychelles–Aldabra tortoises are morphologically variable: http://www.bioone.org/doi/abs/10.2744/CCB-0828.1,0,0,0,0,0,0
66552,b2145f79c0052fef,"Miraculous births 
You may already be watching, but if my last post is a blockable offense, please tell me.  But there has to be some other way to deal with this situation.",0,0,0,0,0,0
124443,99b9abb5964447ea,"Citations 

I previously edited the article with several requests for citations (July 2010) - large sections of this article are not sourced and the cite source requests were edited out. If the information can't be supported, why are they allowed to remain in the article?
24.119.132.83",0,0,0,0,0,0
150992,758be42cc6a106fd,"YOU 

ARE AN A...HOLE!!!",1,0,1,0,1,0
70212,bbd6d50839612983,and can't be used as a source,0,0,0,0,0,0
142672,fb1d4293a587148d,"...so rather the stalker-type (I'm just kidding.) - well, yes... what am I supposed to say. I'll try to better myself. No harm meant!",0,0,0,0,0,0
66012,b08395b0110a984c,Hello Smelly Skunk... how come that you again changed it.. you are a stupid asshole... like your ancestors you gobbled greedily fecal materials.,1,0,1,0,1,0
9968,1a64ff248958cd26,"Good morning 

I was about to go to File:Cieneguilla.jpg  and mark it for speedy deletion myself.  It was used to illustrate a particular point in a discussion in a particular article and was not supposed to last long.  I intentionally left off the copyright info so that the image would be removed.  Please feel free to do so right away, and I am sorry for the bother that this might have caused you.  Einar, aka",0,0,0,0,0,0
82776,dd6f6387d38687f0,"""

Sockpuppetry case
 
You have been accused of sockpuppetry. Please refer to Wikipedia:Suspected sock puppets/Sandra for evidence. Please make sure you make yourself familiar with notes for the suspect before editing the evidence page.   """,0,0,0,0,0,0
128478,af26445442efdb30,"""

 Pharisees 
The context in Sotah a list of false saintly actions and then """"Beware of the Tzvuin (the fakers) who do the actions of Zimri and then request reward like Phineas"""" does imply that there were a class of false pietists.   

What was the Mishna in Avot you mentioned? (RE: Paul\Saul there is some form of tradition that he was actually a Pharisee who was sent by the Rabbis to seperate the Christians from the rest of the Jews (because the early Christians were very similar to the Jews). They say for instance that he initiated the change from Saturday to Sunday (I thought Constantine did that.) """,0,0,0,0,0,0
112224,585f3a7e34f87656,"""

Sounds good - no rush at all. [[User talk:AlexiusHoratius|Horatius]] """,0,0,0,0,0,0
687,01dbc875f2d85f66,ok stop being lame. seriously. go watch pokemon.,1,0,0,0,0,0
54317,9121c2bab0938adf,"""

""""Corroborating evidence"""" is unclear and is in actually just another way of saying """"I don't want this information on the web-page because I am opposed to it."""" As I stated before, the information should be on the page, particularly since it is biographical information that the person about whom the biography was written has stated publicly, both in the Google Video and under testimony during Charles Calderon's proposal of the porn tax bill before the California State Assembly. I am not deleting any of your information, but you are deleting mine. If you don't approve of facts that have been stated by an individual - and they are biographical facts - then you may create an entire separate section on Lubben on this webpage. Please refrain from deleting sources and citations. Veritas, Semper """,0,0,0,0,0,0
58130,9ba93d1f28e0d057,"Yes they do, and thank you for your work.",0,0,0,0,0,0
135544,d4df2e720a769c18,"""

 Lift the protection 

In survey to lift:
Suppport ≈talk≈ 

In opposition to lift:""",0,0,0,0,0,0
917,02868c29e4eca997,"Batman  

I am Batman. You are Spiderman. I win.",0,0,0,0,0,0
151893,845616bb3eee038d,"Petersantos' latest incarnation 

Hi Admin Kanonkas,

This is just to inform you that perma-blocked user Petersantos has risen from the dead as raw IP 222.152.164.160 and is presently engaged in his usual business over there at the Eli Soriano article.

Thank you,",0,0,0,0,0,0
115957,6c08726414e91327,"This is not true. Before the beginning of the show Natalia Germanou says that the source taken by the IFPI. If it was wrong, IFPI would have sued the show but it didn't. Also, the Chart Show have two people of IFPI who study the discography of Greece since 1950. So the sources are reliable.",0,0,0,0,0,0
76282,cc3304bdb74cb663,"""

 Woo Hoo 

Great to see True at First Light on the main page - congrats! Also glad to see you popping up on my watchlist again, all the best,   ><>°° """,0,0,0,0,0,0
116962,712a2526a855f092,"""

 reflinks.py broken?  

I am getting an error on tools:~dispenser/cgi-bin/reflinks.py?page=Manuloc&citeweb;=on. Is it something with the websites, or the tool? Thanks KontribsTalkM 
It was some test code I forgot to remove.  Thanks for reminding me.  —  """,0,0,0,0,0,0
113672,5fd8b4922370d8f1,"3

May 2013
Andy I understand what you said.  What if she is sexist?  How should I respond to her message then?",0,0,0,0,0,0
94935,fdcd8be4f0d2d652,"No need to fight, you're BOTH stalkers to me! Yes, the bicycle is something Frank Zappa could play. Well, sort ofit's kind of like saying you can play a frying pan by beating it rhythmically.",0,0,0,0,0,0
88669,ed32bf46615b8c9e,"Photo 

You can see her tit.69.243.42.251",0,0,0,0,0,0
45349,7946376d7f021f40,"What about Louis winning a Pulitzer Prize, yet not knowing how many 'f's in catastrophic? pretty inconsistant",0,0,0,0,0,0
27457,48ae4840128c8905,"""Why do I have strong suspicions that you're User:Deathlaser? The lack of publishing information in the sources and the type of stubs gave the game away did it not?♦ Dr. Blofeld 

""",0,0,0,0,0,0
135421,d4470745b95350fd,"Page was deleted, it was apparently created by a ban evading user...",0,0,0,0,0,0
96189,028b90778f9b0a92,"""
References get really repetitive after a while. Anyways, all done. What do you think? serenC """,0,0,0,0,0,0
26806,470bab745c696437,"death clear hoax 
this article is one of the biggest jokes on Wikipedia. the introduction section is fucking pathetic, the death section is as lame. Does the CIA fill this page ? Does the white moron house get informed when it's edited ? do you US motherfuckers believe you can act as the rulers of the world for much longer ? Once you get east of germany, nobody believes anything you've been saying for all this years. There is like NO PROOF whatsoever of Bin Laden being alive after like 2002. Videos released again by the terrorist CIA group of a guy with a beard once in a while between 2001 and 2011 make anyone with a brain laugh, same goes for these cia-made videos of a some US agent disguised as an old man with a beard watching stupid shit on tv. This article is an insult to humanity.",1,0,0,0,0,0
133801,cbcd969ccbf4ec26,"Vandalism 

Please refrain from removing content from your talk page. It is considered vandalism.",0,0,0,0,0,0
83566,df99e2b5cfe8a1ce,"==

The word Dwarf Planet",0,0,0,0,0,0
72722,c292730daab206e4,a couple of mouse buttons.,0,0,0,0,0,0
158851,f4cc7eea36dd3b47,"Reply 

I wouldn't post your phone number on Wikipedia. Wikipedia pages are mirrored on MANY other websites, and your number may become very public very quickly. By the way, how old are you?  (Talk) (Contribs) ()",0,0,0,0,0,0
122905,918282c751c16e5b,"—The preceding unsigned comment was added by  (talk • contribs) 23:24, 19 July 2007 (UTC)",0,0,0,0,0,0
57632,9a31847ced6ec64e,There was only one Atalanta!!!!,0,0,0,0,0,0
34785,5ce6a4f4ef390a84,"November 2007)
 Archive Eleven (November 2007 -",0,0,0,0,0,0
50180,861f542e3a4bb53a,"""::You're right.  I wish there was more of an effort for people to include the correct information.  I see the """"feel free to add it yourself"""" kind of stuff as an excuse to not have in included, but it is what it is, and I'll be sure to use the correct terminology (rectums, anuses) instead of words like bootyholes in the actule article, since that would be inappropriate.    

""",0,0,0,0,0,0
129068,b23f1a9a85add23d,how does a piece of dust start sensing light tho?,0,0,0,0,0,0
80229,d6a655049586e681,"Yes you have to be autoconfirmed, you have to be a member for 4 days and edit wikipedia as well then you can post your piece or otherwise post it on the talk page and someone can add it for you.",0,0,0,0,0,0
10768,1c7afa960b108eee,"""

 Move request 

Hi! You recently closed the Talk:National_Film_Awards_(India)#Requested_moves_2 RM as """"no consensus"""". And as you say, poor arguments they were. Unhappy with it, I had yesterday requested more audience at Wikipedia_talk:Noticeboard_for_India-related_topics#NFA_move_request. Can you please relist it once again? By next week I hope we would have more people. §§§§ {T/C} """,0,0,0,0,0,0
29501,4e38f6fcfbadb982,"thanx for lnk, i had unicode-UTF8",0,0,0,0,0,0
